Standard Charge Description,Charge Description Master,Charge as of 1.1.19
DEFIB ELECTRODES,31770202,67.90
DEL-BIRTHING ROOM,40790507,"2,229.55"
DELIVERY - INDUCTION,40790502,"3,032.25"
DELIVERY-MISC,40790509,"2,215.65"
DELIVERY-MULTIPLE,40790504,"3,032.25"
DELIVERY-PREMATURE,40790506,"3,032.25"
DEL-RECVRY RM,40790560,662.00
DEMONSTRATION AND/OR EVALUATION OF MANUAL MANEUVERS TO CHEST WALL TO ASSIST MOVEMENT OF LUNG SECRETIONS,41330062,141.00
DERMABOND PEN,31779701,116.50
DERMABOND TOPICAL ADHESIVE,40790564,71.40
DESTRUCTION OF 1 OR MORE BONE GROWTHS ACCESSED THROUGH THE SKIN,41317184,"4,682.00"
"DESTRUCTION OF 1 OR MORE GROWTHS IN LIVER, ACCESSED THROUGH THE SKIN",41318357,"5,304.00"
"DESTRUCTION OF 1 OR MORE GROWTHS IN ONE KIDNEY, ACCESSED THROUGH THE SKIN",41310283,"9,130.00"
DESTRUCTION OF 2-14 SKIN GROWTHS,41400220,573.00
"DESTRUCTION OF GROWTHS IN ONE KIDNEY, ACCESSED THROUGH THE SKIN",41311081,"14,549.00"
DESTRUCTION OF PERIPHERAL NERVE OR BRANCH,40360050,"1,404.00"
DESTRUCTION OF SKIN GROWTH,41400215,573.00
DESTRUCTION OF SOFT TISSUE OF NASAL PASSAGES,31773813,"1,276.50"
DESTRUCTION OF UP TO 14 SKIN GROWTHS,41400760,142.00
DESTRUCTION OF UPPER OR MIDDLE SPINAL FACET JOINT NERVES USING IMAGING GUIDANCE,41310667,"2,046.00"
DETERMINATION OF LUNG VOLUMES USING GAS DILUTION OR WASHOUT,41380030,225.55
DEV BONE FILL KPHX SZ 3,34301286,650.00
DEV BX 20CM 16GA MNPTY 22MM COAX,34301288,113.75
DEV BX 45IN 14GA TRCT SFT TIS CTE,34301292,87.75
DEV CNCPTV ESSURE IU NONICSL MICR,34301300,"5,037.50"
DEV SUT 2-0 ES-9 7IN BRAID SUT AS,34301317,129.19
DEV SUT 516MM 38CM HNDL PSHBTN GR,34301318,"1,535.63"
DEV VAC XTRT CUP DLV SYS TRAC FRC,34301321,79.63
DEVICE CTO TRUEPATH,34303831,"6,012.50"
DEVICE NEURO CHECK IO-FLEX,34303467,"4,533.75"
DIABETES EDUC-INTERMEDIATE,41958001,90.00
"DIAGNOSTIC ASPIRATION OF SPINAL DISC OR TISSUE, ACCESSED THROUGH THE SKIN",41310611,800.00
DIAGNOSTIC BONE MARROW ASPIRATION,41317075,"1,126.00"
DIAGNOSTIC EXAMINATION OF THE ANUS USING AN ENDOSCOPE,31773116,113.00
DIAGNOSTIC EXAMINATION OF VOICE BOX USING AN ENDOSCOPE,31773621,132.00
DIAGNOSTIC TESTING IN A PULMONARY FUNCTION LAB,41390026,208.00
DILATOR NIM-SPINE DISPOSABLE L,34303621,"2,437.50"
DISC CERVICAL ARTIFICIAL -5200,34303982,"16,900.00"
DISP ABDOMINAL RETRACTOR,40790752,392.45
DISP INTRAUTERINE CATH,40791000,142.70
"DISP RETRACTOR, ALEXIS",40790755,202.00
DISPOSABLE VACUUM,40790407,36.25
DISSECTOR GLIDEPATH -1800,34305169,"5,850.00"
DRAINAGE OF ABSCESS OR BLOOD COLLECTION AT LOWER LEG OR ANKLE,31773435,"2,561.00"
"DRAINAGE OF ABSCESS, CYST, OR BLOOD ACCUMULATION OF DENTAL BONE",31773665,326.70
DRAINAGE OF BREAST ABSCESS,31773002,"2,560.65"
DRAINAGE OF FINGER ABSCESS,31773326,"1,834.35"
DRAINAGE OF FLUID FROM ABDOMINAL CAVITY,31772027,"1,095.35"
DRAINAGE OF FLUID FROM ABDOMINAL CAVITY USING IMAGING GUIDANCE,41310478,"1,325.25"
DRAINAGE OF FLUID-FILLED SAC (BURSA) OF FOOT,41400308,"3,367.00"
DRAINAGE OF MULTIPLE ABSCESS,31773000,332.80
DRAINAGE OF RECTAL ABSCESS,31773001,"2,841.30"
DRAINAGE OF TAILBONE CYST,31773006,"1,834.35"
DRAINAGE OF TONSIL ABSCESS,31773670,326.70
DRAINAGE OF WOUND INFECTION AFTER SURGERY,31773186,"1,942.00"
DRAPE PACK,41470705,317.20
DRAPE X-RAY UNIVERSAL,41470940,14.14
DRESSING CHANGE AND/OR REMOVAL OF BURN TISSUE (5% TO 10% TOTAL BODY SURFACE),31773172,353.00
DRESSING CHANGE AND/OR REMOVAL OF BURN TISSUE (GREATER THAN 10% TOTAL BODY SURFACE),31773175,260.00
DRESSING CHANGE AND/OR REMOVAL OF BURN TISSUE (LESS THAN 5% TOTAL BODY SURFACE),31773165,573.00
DRN INCS 3/32IN SIL 5IN END PERF,34301347,48.36
DRN WND TUBE FLAT CLS SCT HBLS RL,34301366,21.74
DRN WND W TROC 025IN END PRFR STR,34301367,55.51
DRSG BRN ABS NADH ML LR 15X9IN ST,34301370,10.40
DRSG CRTY 3X3IN NADH KNTD WND OIL,34301371,0.07
DRSG PETRO 8X1IN NADH BCTRST PTCH,34301382,1.53
DRSG THK15CM XL 60X30CM OPEN PORE,34301391,344.76
DRSG WND ADH ILND STRL TELFA 40 X,34301399,2.63
DRUG INFUSION DURING CARDIAC CATHETERIZATION,41460635,500.00
DRUG INFUSION OR EXERCISE FOR HEART STIMULATION DURING DIAGNOSTIC STUDY,41470169,500.00
DRUG SCLEROSING AGENT POWDER,34302844,390.00
DSG OPSITE -40,34303685,130.00
DURMABOND,41479067,102.60
DVC TORQUE GUIDEWIRE SEADRAGON,34303399,14.63
E/R SUTURE SET,31770060,91.90
"EBUS, GUILDE SHEATH KIT",41380105,422.00
EBUS-FNA NDL W/VAC SYR 19G,41380103,"1,092.00"
EDGE BRONCH PROCEDURE KIT DISP,41380022,"3,558.75"
"ELECTRICAL STIMULATION (UNATTENDED), TO ONE OR MORE AREAS FOR INDICATION(S) OTHER THAN WOUND CARE, AS PART OF A THERAPY PLAN OF CARE",41210101,93.65
ELECTRODE COAGULATING,34302751,268.13
ELECTRODES SPIRAL,40790553,36.95
EMBOLIZATION PROTECTIVE SYSTEM,41471123,"5,687.50"
"EMERGENCY DEPARTMENT VISIT, LOW TO MODERATELY SEVERE PROBLEM",31770501,188.00
"EMERGENCY DEPARTMENT VISIT, MODERATELY SEVERE PROBLEM",31770502,306.00
"EMERGENCY DEPARTMENT VISIT, PROBLEM OF HIGH SEVERITY",31772508,953.00
"EMERGENCY DEPARTMENT VISIT, PROBLEM WITH SIGNIFICANT THREAT TO LIFE OR FUNCTION",31772509,"1,145.00"
"EMERGENCY DEPARTMENT VISIT, SELF LIMITED OR MINOR PROBLEM",31770500,144.00
EMERGENT INSERTION OF BREATHING TUBE INTO WINDPIPE CARTILAGE USING AN ENDOSCOPE,31772014,"1,267.91"
EMERGENT SURGICAL OPENING OF WINDPIPE FOR INSERTION OF BREATHING TUBE,31773620,"1,273.55"
EMERGENT SURGICAL OPENING OF WINDPIPE THROUGH NECK FOR INSERTION OF BREATHING TUBE,31772026,"1,276.50"
ENDO-TRACHEAL TUBE,41330077,40.80
"ENDOTRACHEAL TUBES, ALL SZ",31770032,24.50
ENEMA KIT-DISP,31770098,4.50
ENVELOPE ICD AIGIS,41470643,"2,908.75"
EPIDURAL ANESTHESIA FIRST HOUR,40360208,655.00
EPIDURAL TRAY,40790750,80.90
EPIDURAL WITH GENERAL ANESTHESIA FIRST HOUR,40360209,"1,050.00"
ER OXYGEN THERAPY,31771269,65.10
ER VENT INITIATION SUPPLIES,41330202,296.95
ERASER HEMO WET FIELD TPR 23GA,34301429,104.00
ER-OXYGEN,41330200,65.10
"ESTABLISHED PATIENT OFFICE OR OTHER OUTPATIENT VISIT, TYPICALLY 10 MINUTES",41400836,48.50
"ESTABLISHED PATIENT OFFICE OR OTHER OUTPATIENT VISIT, TYPICALLY 15 MINUTES",41400837,71.45
"ESTABLISHED PATIENT OFFICE OR OTHER OUTPATIENT VISIT, TYPICALLY 5 MINUTES",41400211,53.00
"ESTABLISHED PATIENT OFFICE OR OTHER OUTPATIENT, VISIT TYPICALLY 25 MINUTES",41400838,118.40
EVALUATION AND INSERTION OF CATHETERS FOR CREATION OF COMPLETE HEART BLOCK,41471353,"15,460.00"
"EVALUATION AND INSERTION OF CATHETERS FOR RECORDING, PACING, AND ATTEMPTED INDUCTION OF ABNORMAL HEART RHYTHM",41471354,"15,460.00"
"EVALUATION AND INSERTION OF CATHETERS FOR RECORDING, PACING, AND TREATMENT OF ABNORMAL HEART RHYTHM",41471356,"15,460.00"
"EVALUATION AND PROGRAMMING ADJUSTMENT OF DEFIBRILLATOR WITH ANALYSIS, REVIEW AND REPORT",41470070,80.00
EVALUATION OF HEART FUNCTION USING TILT TABLE,41483838,599.35
"EVALUATION OF OCCUPATIONAL THERAPY ESTABLISHED PLAN OF CARE, TYPICALLY 60 MINUTES",41210355,201.00
"EVALUATION OF OCCUPATIONAL THERAPY, TYPICALLY 30 MINUTES",41210353,153.00
"EVALUATION OF OCCUPATIONAL THERAPY, TYPICALLY 45 MINUTES",41210354,177.00
"EVALUATION OF PHYSICAL THERAPY, TYPICALLY 20 MINUTES",41210350,153.00
"EVALUATION OF PHYSICAL THERAPY, TYPICALLY 30 MINUTES",41210351,177.00
"EVALUATION OF PHYSICAL THERAPY, TYPICALLY 45 MINUTES",41210352,201.00
EVALUATION OF SINGLE OR DUAL CHAMBER PACING CARDIOVERTER-DEFIBRILLATOR AND GENERATOR AT TIME OF IMPLANTATION OR REPLACEMENT,41471026,"1,070.30"
EVALUATION OF SINGLE OR DUAL CHAMBER PACING CARDIOVERTER-DEFIBRILLATOR AT TIME OF IMPLANTATION OR REPLACEMENT,41470726,826.05
EVALUATION OF SINGLE OR DUAL CHAMBER PACING CARDIOVERTER-DEFIBRILLATOR WITH PROGRAMMING OR REPROGRAMMING,40760224,947.10
EVALUATION OF SPEECH FLUENCY,41190205,312.00
EVALUATION OF SPEECH SOUND PRODUCTION,41190208,315.00
EVALUATION OF SPEECH SOUND PRODUCTION WITH EVALUATION OF LANGUAGE COMPREHENSION AND EXPRESSION,41190211,491.00
EVALUATION OF SWALLOWING FUNCTION,41190158,205.10
"EVALUATION, TESTING, AND PROGRAMMING ADJUSTMENT OF SINGLE, DUAL, OR MULTIPLE LEAD PACEMAKER SYSTEM BEFORE OR AFTER SURGERY, PROCEDURE, OR TEST WITH QUALIFIED HEALTH CARE PROFESSIONAL ANALYSIS, REVIEW, AND REPORT",41470066,80.00
"EVENT RECORDER, CARDIAC (IMPLANTABLE)",41470058,"16,233.75"
EXCHANGE OF ABDOMINAL CAVITY DRAINAGE CATHETER USING IMAGING GUIDANCE,41314352,"2,168.00"
"EXCISION OF BLOOD CLOT AND/OR INFUSION TO DISSOLVE BLOOD CLOT AND BALLOON DILATION OF DIALYSIS SEGMENT, ACCESSED THROUGH THE SKIN, WITH IMAGING INCLUDING RADIOLOGICAL SUPERVISION AND INTERPRETATION",41319529,"31,173.00"
EXERCISE OR DRUG-INDUCED HEART AND BLOOD VESSEL STRESS TEST WITH EKG TRACING AND MONITORING,41252024,704.80
EXERCISE TEST FOR SPASM OF LUNG AIRWAYS,41390425,285.45
EXT TEMP PACEMAKER,31770200,196.80
EXTENSION SET WITH T 16431,41470900,23.20
"EXTERNAL REF PATCH,6FR,HYPER",41470610,"1,625.00"
EXTERNAL SHOCK TO HEART TO REGULATE HEART BEAT,31772001,624.30
"EYE SHIELD, FOX",31770117,9.05
FEMORAL DRAPE,41470589,39.45
FEMSTOP,41470773,195.35
FETAL CONTRACTION STRESS TEST,40790525,334.90
FETAL NON-STRESS TEST,40790522,334.90
FIRST DEGREE BURN TREATMENT,31773162,142.00
"FLUID COLLECTION DRAINAGE BY CATHETER USING IMAGING GUIDANCE, ACCESSED THROUGH THE SKIN",41310265,"1,808.00"
FLUOROSCOPIC AND VIDEO RECORDED MOTION EVALUATION OF SWALLOWING FUNCTION,41193008,256.75
"FOAM DRESSING, WOUND COVER, STERILE, PAD SIZE MORE THAN 16 SQ. IN. BUT LESS THAN OR EQUAL TO 48 SQ. IN., WITHOUT ADHESIVE BORDER, EACH DRESSING",41400529,4.29
"FOAM DRESSING, WOUND COVER, STERILE, PAD SIZE MORE THAN 48 SQ. IN., WITHOUT ADHESIVE BORDER, EACH DRESSING",41400528,27.59
FOLEY CATH TRAY,41470590,25.30
FORCEP BAYONET BIPOLAR,34303643,"2,676.83"
FORCEP BIOPSY SUPERTRAX,41380015,245.40
FORCEP BX STD FEN 20MM,34301467,942.50
FORCEPS BIPOLAR COAPTATION,34302773,35.75
FORCEPS BX W NEEDLE,40480034,131.92
"GASTROSTOMY TUBE, MIC",31770212,114.35
GENERAL ANESTHESIA FIRST HOUR,40360011,975.00
"GENERATOR, NEUROSTIMULATOR (IMPLANTABLE), NON-RECHARGEABLE,NEUROSTIM PULSE GEN -26100",34305117,"84,825.00"
"GENERATOR, NEUROSTIMULATOR (IMPLANTABLE), WITH RECHARGEABLE BATTERY AND CHARGING SYSTEM,ANS IPG 16 CHANNEL RECHARGE 3788",34303267,"45,483.75"
"GENERATOR, NEUROSTIMULATOR (IMPLANTABLE), WITH RECHARGEABLE BATTERY AND CHARGING SYSTEM,ANS MINI CHARGING SYSTEM 3721",34303268,"3,246.75"
GLIDE OPTHALMIC IMPLANT,34300206,4.68
GLIDING MATTRESS FULL,40790408,260.00
GOWN AND TOWEL DISP,41470919,8.05
GRAFT BONE BMP LG,34300208,"18,100.00"
GRAFT BONE BMP MED,34300209,"16,403.00"
GRAFT BONE CANC 30CC,34300213,"1,489.31"
GRAFT BONE CANCELLOUS -610,34303720,"1,976.00"
GRAFT BONE CORT SEG LG 8X72CC,34300221,"2,044.25"
GRAFT BONE DBM 10CC PUTTY,34300223,"4,443.00"
GRAFT BONE GRAFTON STRIP 1 X 10CM,34300230,"3,677.96"
GRAFT BONE LORDOTIC -650,34303656,"2,112.50"
GRAFT BONE SPACER PARALLEL LGAP,34300233,"2,437.50"
GRAFT BONE STRIP 1X10 CM,34303640,"2,033.62"
GRAFT CV STENT -16000,34303796,"49,710.38"
GRAFT FILTER RIA,34303682,956.74
GRAFT STENT END EXT -420,34303702,"1,365.00"
GRAFT STENT VALIANT -16750,34305082,"54,437.00"
GRAFT TISS PATCH DURA PRECLUDE 4X,34300321,845.00
"GRAFT, VASCULAR,FELT CV THK165MM 6X6IN PTFE",34301444,396.50
"GRAFT, VASCULAR,GRAFT CV EXTR ATR CTR HEL SUPP VS",34300241,"1,382.55"
"GRAFT, VASCULAR,GRAFT CV EXTR DIALYSIS STR BARD",34300248,507.00
"GRAFT, VASCULAR,GRAFT GORE TAG TGT ANY",34303191,"39,243.75"
"GRAFT, VASCULAR,GRAFT SAPHENOUS CRYOLIFE>80CM",34303387,"28,925.00"
"GRAFT, VASCULAR,PTCH CV 25X12CM PRGRD BVN PRICRD",34302051,"2,642.25"
GROUP PSYCHOTHERAPY PHP,41908004,206.05
GRSP ENDO 5MM,34300327,557.93
GUIDE LIGHT MAXCESS,34303453,"1,212.25"
GUIDE WIRE,41380022,"3,558.75"
"GUIDE WIRE,DILATOR SET URETHRAL -220",34303969,717.08
"GUIDE WIRE,GUIDEWIRE .014",34303400,422.50
"GUIDE WIRE,GUIDEWIRE CV FIXED CORE",34300344,45.50
"GUIDE WIRE,GUIDEWIRE ORTHO- 70",34303991,227.50
"GUIDE WIRE,GUIDEWIRE ORTHO NITINOL",34300357,136.50
"GUIDE WIRE,GUIDEWIRE ORTHO SINGLE TROCAR TIP",34300358,47.78
"GUIDE WIRE,KIT GUIDEWIRE HEMODIALYSIS",34303009,"1,394.93"
GUIDEPIN ORTHO TRIGEN,34302888,383.47
GYRUS MICROELECTRODE 007261-901,34303356,"1,075.50"
HALF SHEET STERILE DISP,41470915,6.55
HAND CONTROLLER-DISP,41470953,39.38
HANDLE DISTAL IO-FLEX,34303468,"1,121.25"
HEATED WIRE CIRCUIT,41331678,47.80
HEMOSTATIC ABSORBL POWDR-ARISTA,41470496,511.90
HEMOSTATIS PATCH,41485003,108.00
HEX WRENCH PACEMAKER,34303457,146.25
HEXAGEN WOUND DRESSING,40790150,115.00
HIFI VENT CIRCUIT,41331676,917.45
HIGH RISK INTENSIVE CARE,40790006,"2,175.00"
HME,41331670,10.55
HYDRATION INFUSION INTO A VEIN,31773171,57.90
HYDRATION INFUSION INTO A VEIN 31 MINUTES TO 1 HOUR,31773170,318.95
IABP CATHETER,41470537,"2,955.40"
ICU-STEPDOWN,31633001,"2,175.00"
"I-IMMOBILIZER KNEE UNIV 20""",41786036,54.93
I-KIT CATH CV TRPL LUMEN 7FRX20,41786041,301.80
"ILIAC AND/OR FEMORAL ARTERY ANGIOGRAPHY, NON-SELECTIVE, BILATERAL OR IPSILATERAL TO CATHETER INSERTION, PERFORMED AT THE SAME TIME AS CARDIAC CATHETERIZATION AND/OR CORONARY ANGIOGRAPHY, INCLUDES POSITIONING OR PLACEMENT OF THE CATHETER IN THE DISTAL AORTA OR IPSILATERAL FEMORAL OR ILIAC ARTERY, INJECTION OF DYE, PRODUCTION OF PERMANENT IMAGES, AND RADIOLOGIC SUPERVISION AND INTERPRETATION (LIST SEPARATELY IN ADDITION TO PRIMARY PROCEDURE)",41470860,"1,230.70"
IMMOBILIZER SHOULDER MEDIUM,41781101,98.25
IMMOBILIZER SHOULDER-15,34300378,48.75
IMOB CST J SPLNT PLSTR RL SPCLST,40751493,613.44
IMPL BREAST -1100,34305093,"3,575.00"
IMPLANT CRANIAL PEEK -14430,34305158,"46,897.50"
IMPLANT EAR TUBE VENT-20,34300400,65.00
"IMPLANTABLE ACCESS CATHETER, (E.G., VENOUS, ARTERIAL, EPIDURAL SUBARACHNOID, OR PERITONEAL, ETC.) EXTERNAL ACCESS,CATH DIALYSIS PERITON-50",34302664,162.50
INCENTIVE SPIROMETER,41330080,93.35
INCISION AND DRAINAGE OF ABSCESS IN SCROTAL SAC OF TESTICLE,31773125,"2,561.00"
INCISION AND DRAINAGE OF EXTERNAL EAR ABSCESS OR BLOOD ACCUMULATION,31773153,479.00
INCISION AND DRAINAGE OF FEMALE GENITAL GLAND ABSCESS,31773132,374.10
INCISION AND DRAINAGE OF FEMALE GENITALS ABSCESS,31773436,374.10
"INCISION OF ABSCESS, CYST, OR BLOOD ACCUMULATION IN MOUTH",31773660,479.00
INCISION OF ENGORGED EXTERNAL HEMORRHOID,31773102,550.80
INEVITABLE MISCARRIAGE <22 WKS,40790545,"2,229.55"
INFANT RESUS BAG,40790500,64.05
INFANT SCREENING W/ABR,31810510,180.00
INFUSION INTO A VEIN FOR THERAPY PREVENTION OR DIAGNOSIS ADDITIONAL SEQUENTIAL INFUSION UP TO 1 HOUR,31773182,57.90
"INFUSION INTO A VEIN FOR THERAPY, PREVENTION, OR DIAGNOSIS",31771278,86.85
"INFUSION INTO A VEIN FOR THERAPY, PREVENTION, OR DIAGNOSIS UP TO 1 HOUR",31771277,318.95
"INFUSION INTO A VEIN FOR THERAPY, PREVENTION, OR DIAGNOSIS, CONCURRENT WITH ANOTHER INFUSION",31773181,57.90
INFUSION OF DRUG INTO A VEIN TO DISSOLVE BLOOD CLOT OBSTRUCTING BLOOD FLOW TO BRAIN,31773655,357.40
INFUSION OF DRUG INTO VEIN TO DISSOLVE CORONARY BLOOD CLOT,31773201,357.40
"INFUSION PUMP, PROGRAMMABLE (IMPLANTABLE),CATH PAIN MANAGEMENT",34302683,812.50
INITIAL DIABETES ASSESS AND EDUC,41958009,35.00
INITIATION AND MANAGEMENT OF CONTINUED PRESSURED RESPIRATORY ASSISTANCE BY MASK OR BREATHING TUBE,41331650,232.95
"INJECTABLE BULKING AGENT, SYNTHETIC IMPLANT, URINARY TRACT, 1 ML SYRINGE, INCLUDES SHIPPING AND NECESSARY SUPPLIES,IMPL MACROPLASTIQUE 2.5ML",34305163,198.00
"INJECTION BENEATH THE SKIN OR INTO MUSCLE FOR THERAPY, DIAGNOSIS, OR PREVENTION",31771203,89.20
INJECTION FOR X-RAY IMAGING OF BREAST DUCT,31730099,370.60
INJECTION FOR X-RAY IMAGING OF PULMONARY (LUNG) ARTERY FROM HEART,41460638,500.00
INJECTION FOR X-RAY IMAGING OF RIGHT UPPER OR LOWER HEART,41460636,500.00
INJECTION FOR X-RAY IMAGING PROCEDURE ON VEINS OF ARM OR LEG,41315810,548.90
INJECTION OF ABNORMAL MUSCLE DRAINAGE TRACT FOR X-RAY STUDY,41315179,128.45
INJECTION OF AGENT TO DESTROY ABDOMINAL SYMPATHETIC NERVE BUNDLE,41316987,"2,131.67"
"INJECTION OF ANESTHETIC AGENT, FACIAL NERVE",31773134,357.05
"INJECTION OF ANESTHETIC AGENT, OTHER PERIPHERAL NERVE OR BRANCH",31773135,541.00
"INJECTION OF ANESTHETIC AGENT, TRIGEMINAL NERVE",31773136,357.05
INJECTION OF BILE DUCT FOR X-RAY IMAGING PROCEDURE ACCESSED THROUGH THE SKIN USING IMAGING GUIDANCE INCLUDING RADIOLOGICAL SUPERVISION AND INTERPRETATION,41315003,"2,431.00"
INJECTION OF BLOOD OR BLOOD CLOT INTO SPINAL CANAL,31771255,882.95
INJECTION OF BONE CEMENT INTO BODY OF LOWER SPINE BONE ACCESSED THROUGH THE SKIN USING IMAGING GUIDANCE,41317692,"13,361.00"
INJECTION OF BONE CEMENT INTO BODY OF MIDDLE SPINE BONE ACCESSED THROUGH THE SKIN USING IMAGING GUIDANCE,41317166,"13,361.00"
"INJECTION OF DIFFERENT DRUG OR SUBSTANCE INTO A VEIN FOR THERAPY, DIAGNOSIS, OR PREVENTION",31773190,126.30
INJECTION OF DRUG INTO ERECTILE TISSUE AT SIDES AND BACK OF PENIS,31773437,410.55
"INJECTION OF DRUG OR SUBSTANCE INTO A VEIN FOR THERAPY, DIAGNOSIS, OR PREVENTION",31771204,164.10
"INJECTION OF DRUG OR SUBSTANCE INTO A VEIN FOR THERAPY, DIAGNOSIS, OR PREVENTION, IN A FACILITY",31773868,57.90
INJECTION OF DYE FOR X-RAY IMAGING AND/OR CT OF LOWER SPINAL CANAL,41310011,771.00
INJECTION OF DYE FOR X-RAY IMAGING OF ELBOW JOINT,41430545,694.30
INJECTION OF DYE FOR X-RAY IMAGING OF HIP JOINT,41313522,745.55
INJECTION OF DYE FOR X-RAY IMAGING OF SHOULDER JOINT,41313042,677.55
INJECTION OF DYE FOR X-RAY IMAGING OF WRIST JOINT,41430556,518.20
INJECTION OF DYE FOR X-RAY OF SALIVARY GLANDS,41310392,772.10
INJECTION OF RADIOACTIVE DYE FOR X-RAY IDENTIFICATION OF LYMPH NODE,31750025,355.60
INJECTION OF SUBSTANCE INTO SPINAL CANAL OF LOWER BACK OR SACRUM USING IMAGING GUIDANCE,41318372,"1,405.00"
INJECTION OF UP TO 7 SKIN GROWTHS,41400009,142.00
INJECTION PROCEDURE FOR X-RAY IMAGING OF KIDNEY AND URINARY DUCT (URETER) USING IMAGING GUIDANCE INCLUDING RADIOLOGICAL SUPERVISION AND INTERPRETATION,41310743,"1,114.00"
INJECTION PROCEDURE FOR X-RAY IMAGING OF THE BLADDER OR DURING VOIDING,41314456,651.25
INJECTION PROCEDURE THROUGH THE BLADDER AND BLADDER CANAL (URETHRA) FOR X-RAY IMAGING,41315200,882.95
"INJECTION TO CAUSE BLOOD CLOT IN A DISEASED OR BULGING VESSEL OF ARM OR LEG, ACCESSED THROUGH THE SKIN",41318362,578.00
"INJECTION, LIDOCAINE HCL FOR INTRAVENOUS INFUSION, 10 MG",41400519,35.95
"INJECTION, LINEZOLID, 200 MG",41400513,312.15
"INJECTION, TRIAMCINOLONE ACETONIDE, NOT OTHERWISE SPECIFIED, 10 MG",41400520,182.70
INJECTIONS OF ANESTHETIC AND/OR STEROID DRUG INTO NERVE OF FOOT,41400759,368.90
INJECTIONS OF TENDON ATTACHMENT TO BONE,31773822,357.05
"INJECTIONS OF TENDON SHEATH, LIGAMENT, OR MUSCLE MEMBRANE",31773193,369.00
INJECTIONS OF TRIGGER POINTS IN 1 OR 2 MUSCLES,31773720,369.00
INJECTIONS OF TRIGGER POINTS IN 3 OR MORE MUSCLES,31773725,357.05
INJECTOR UT 40MM,34301623,54.18
INO THERAPY/HOUR,41331602,334.50
"INSERTION OF ABDOMINAL CAVITY CATHETER FOR DRAINAGE OR DIALYSIS, OPEN PROCEDURE",41310674,"2,907.00"
INSERTION OF ARTERIAL CATHETER FOR BLOOD SAMPLING OR INFUSION,31770087,124.00
"INSERTION OF ARTERIAL CATHETER FOR BLOOD SAMPLING OR INFUSION, ACCESSED THROUGH THE SKIN",41330132,150.00
INSERTION OF CATHETER (ACCESSED THROUGH THE SKIN) INTO GALLBLADDER USING IMAGING GUIDANCE INCLUDING RADIOLOGICAL SUPERVISION AND INTERPRETATION,41310079,"4,690.00"
INSERTION OF CATHETER FOR RECORDING TO IDENTIFY ORIGIN OF ABNORMAL HEART RHYTHM,41470714,"1,378.45"
INSERTION OF CATHETER FOR RECORDING UPPER HEART RHYTHM,41470711,"4,438.00"
INSERTION OF CATHETER FOR SUCTION OF SECRETIONS,41331681,156.00
INSERTION OF CATHETER IN RIGHT HEART FOR X-RAY IMAGING OF BLOOD VESSELS OR GRAFTS,41460629,"8,000.00"
INSERTION OF CATHETER INTO ABDOMINAL PELVIC OR LEG ARTERY,41315708,494.00
INSERTION OF CATHETER INTO AN ARTERY OF A LOBE OF THE LUNG,41470759,"1,193.95"
INSERTION OF CATHETER INTO AORTA,41310004,367.40
INSERTION OF CATHETER INTO ARTERY ON ONE SIDE OF NECK FOR DIAGNOSIS OR TREATMENT INCLUDING RADIOLOGICAL SUPERVISION AND INTERPRETATION,41310118,"7,226.00"
INSERTION OF CATHETER INTO ARTERY ON ONE SIDE OF NECK OR CHEST FOR DIAGNOSIS OR TREATMENT INCLUDING RADIOLOGICAL SUPERVISION AND INTERPRETATION,41471343,"3,860.00"
INSERTION OF CATHETER INTO CHEST OR ARM ARTERY,41315235,"1,239.30"
INSERTION OF CATHETER INTO LEFT HEART FOR DIAGNOSIS,41470161,"7,000.00"
INSERTION OF CATHETER INTO RIGHT AND LEFT HEART FOR DIAGNOSIS,41470502,"8,000.00"
INSERTION OF CATHETER INTO RIGHT UPPER HEART CHAMBER AND PULMONARY (LUNG) ARTERY FOR MONITORING PURPOSES,41471040,"2,227.90"
INSERTION OF CATHETER INTO VEIN,41315005,370.60
INSERTION OF CATHETER INTO VEIN WITH COLLECTION OF BLOOD SAMPLE,41315818,811.00
INSERTION OF CATHETER THROUGH THE CERVIX INTO FALLOPIAN TUBE,41318345,"2,685.61"
INSERTION OF CATHETERS FOR 3D MAPPING OF ELECTRICAL IMPULSES TO HEART MUSCLES,41470873,"5,886.15"
INSERTION OF CATHETERS FOR CREATION OF COMPLETE HEART BLOCK,41471023,"4,438.00"
"INSERTION OF CATHETERS FOR RECORDING, PACING, AND ATTEMPTED INDUCTION OF ABNORMAL RHYTHM IN LEFT UPPER HEART",41470721,"1,916.00"
"INSERTION OF CATHETERS FOR RECORDING, PACING, AND ATTEMPTED INDUCTION OF ABNORMAL RHYTHM IN RIGHT UPPER AND LOWER HEART",41470720,"5,611.05"
INSERTION OF CATHETERS FOR TREATMENT OF ABNORMAL HEART RHYTHM,41471355,"4,280.00"
INSERTION OF CATHETERS INTO MAIN AND ACCESSORY ARTERIES OF BOTH KIDNEYS FOR IMAGING INCLUDING RADIOLOGICAL SUPERVISION AND INTERPRETATION,41460674,"4,640.00"
INSERTION OF CATHETERS INTO MAIN AND ACCESSORY ARTERIES OF ONE KIDNEY FOR IMAGING INCLUDING RADIOLOGICAL SUPERVISION AND INTERPRETATION,41310618,"4,640.00"
INSERTION OF CENTRAL VENOUS CATHETER AND IMPLANTED DEVICE FOR INFUSION BENEATH THE SKIN,41317113,"8,719.60"
"INSERTION OF CENTRAL VENOUS CATHETER FOR INFUSION WITH PORT BENEATH THE SKIN, PATIENT 5 YEARS OR OLDER",41317119,"2,231.40"
"INSERTION OF CENTRAL VENOUS CATHETER FOR INFUSION, PATIENT 5 YEARS OR OLDER",41317110,"2,082.00"
"INSERTION OF CENTRAL VENOUS CATHETER FOR INFUSION, PATIENT YOUNGER THAN 5 YEARS",41317116,"1,327.10"
"INSERTION OF CENTRAL VENOUS CATHETERS FOR INFUSION, TWO CATHETERS IN TWO VEINS",41317114,"3,185.00"
INSERTION OF ELECTRODE FOR PERMANENT PACEMAKER OR PACING DEFIBRILLATOR DEVICE,41471012,"6,155.00"
"INSERTION OF INTRAVASCULAR STENTS IN ARTERY (EXCEPT LOWER EXTREMITY, CERVICAL CAROTID, EXTRACRANIAL VERTEBRAL OR INTRATHORACIC CAROTID, INTRACRANIAL, OR CORONARY), OPEN OR ACCESSED THROUGH THE SKIN, WITH RADIOLOGICAL SUPERVISION AND INTERPRETATION",41315243,"12,703.00"
"INSERTION OF INTRAVASCULAR STENTS IN VEIN, OPEN OR ACCESSED THROUGH THE SKIN, WITH RADIOLOGICAL SUPERVISION AND INTERPRETATION",41471126,"12,703.00"
INSERTION OF LEFT HEART ELECTRODE FOR PACING DEFIBRILLATOR DEVICE,41473346,"12,488.00"
INSERTION OF LOWER HEART CHAMBER BLOOD FLOW ASSIST DEVICE THROUGH THE SKIN INCLUDING RADIOLOGICAL SUPERVISION AND INTERPRETATION,41470130,"14,545.00"
INSERTION OF NASAL OR ORAL STOMACH TUBE USING FLUOROSCOPIC GUIDANCE,41313596,276.00
"INSERTION OF NEEDLE AND/OR CATHETER INTO DIALYSIS CIRCUIT AND BALLOON DILATION OF DIALYSIS SEGMENT, WITH IMAGING INCLUDING RADIOLOGICAL SUPERVISION AND INTERPRETATION",41319525,"10,176.00"
"INSERTION OF NEEDLE AND/OR CATHETER INTO DIALYSIS CIRCUIT, WITH IMAGING INCLUDING RADIOLOGICAL SUPERVISION AND INTERPRETATION",41310008,"1,443.00"
INSERTION OF NEEDLE FOR INFUSION INTO BONE,31772013,309.40
INSERTION OF NEEDLE INTO VEIN FOR COLLECTION OF BLOOD SAMPLE,41301000,9.75
INSERTION OF NEEDLE OR CATHETER INTO A VEIN,41470124,78.50
INSERTION OF NEEDLE OR CATHETER INTO AN ARTERY OF ARM OR LEG,41470858,"1,070.30"
INSERTION OF NEW OR REPLACEMENT OF PERMANENT PACEMAKER INCLUDING UPPER AND LOWER CHAMBER ELECTRODES,41473208,"8,939.00"
INSERTION OF PACEMAKER PULSE GENERATOR WITH EXISTING DUAL LEADS,41471011,"10,136.00"
INSERTION OF PACEMAKER PULSE GENERATOR WITH EXISTING SINGLE LEAD,41471001,"6,155.00"
INSERTION OF PACING DEFIBRILLATOR PULSE GENERATOR WITH EXISTING MULTIPLE LEADS,41470666,"53,320.00"
INSERTION OF PERMANENT CATHETER FOR DRAINAGE OF LUNG FLUID,41318379,"4,883.00"
INSERTION OF SHUNTS TO BYPASS BLOOD FLOW TO LIVER USING IMAGING GUIDANCE,41317081,"14,039.15"
"INSERTION OF STENT, REMOVAL OF PLAQUE AND/OR BALLOON DILATION OF CORONARY VESSEL DURING HEART ATTACK, ACCESSED THROUGH THE SKIN",41471403,"8,240.00"
"INSERTION OF STENT, REMOVAL OF PLAQUE AND/OR BALLOON DILATION OF CORONARY VESSEL, ACCESSED THROUGH THE SKIN",41471395,"8,776.00"
"INSERTION OF STENTS AND BLOOD CLOT PROTECTION DEVICE IN NECK ARTERY, OPEN OR ACCESSED THROUGH THE SKIN",41471099,"4,863.00"
"INSERTION OF STENTS IN ARTERY IN ONE SIDE OF GROIN, ENDOVASCULAR, ACCESSED THROUGH THE SKIN OR OPEN PROCEDURE",41470144,"8,776.00"
"INSERTION OF STENTS INTO ARTERIES IN ONE LEG, ENDOVASCULAR, ACCESSED THROUGH THE SKIN OR OPEN PROCEDURE",41470149,"18,355.00"
"INSERTION OF STENTS INTO ARTERY IN ONE LEG, ENDOVASCULAR, ACCESSED THROUGH THE SKIN OR OPEN PROCEDURE",41470137,"18,355.00"
"INSERTION OF STENTS INTO GROIN ARTERY, ENDOVASCULAR, ACCESSED THROUGH THE SKIN OR OPEN PROCEDURE",41470147,"8,645.00"
INSERTION OF STOMACH TUBE (ACCESSED THROUGH THE SKIN) USING FLUOROSCOPIC GUIDANCE WITH CONTRAST,41310301,"1,200.00"
INSERTION OF STOMACH TUBE AND ASPIRATIONS OF GASTRIC CONTENTS,31772010,245.00
INSERTION OF TEMPORARY BLADDER CATHETER,31741247,113.00
INSERTION OF TEMPORARY PACEMAKER ELECTRODE FOR DIAGNOSTIC UPPER HEART PACING,41470715,"4,438.00"
"INSERTION OF VENA CAVA FILTER BY ENDOVASCULAR APPROACH, INCLUDING RADIOLOGICAL SUPERVISION AND INTERPRETATION",41315820,"6,904.00"
INSERTION OR REPLACEMENT OF DEFIBRILLATOR WITH ELECTRODE,41471423,"52,800.00"
INSERTION OR REPLACEMENT OF PERMANENT PACEMAKER AND LOWER CHAMBER ELECTRODES,41471024,"8,139.00"
INSERTION OR REPLACEMENT OF PERMANENT PACEMAKER AND UPPER CHAMBER ELECTRODES,41479000,"8,139.00"
INSERTION OR REPLACEMENT OF SINGLE OR DUAL CHAMBER PACING DEFIBRILLATOR LEADS,41473595,"27,137.00"
INSYTE IV CATH 18GA,41470912,16.20
INTENSIVE CARE,44309002,"2,175.00"
INTENSIVE OP GROUP PSYCHOTHERAPY,41908005,206.05
INTERCEDE ADHESION BARRIER #7509,40790561,347.20
INTERCEDE ADHESION BARRIER #7509,40790561,347.20
"INTERPHALANGEAL FINGER JOINT REPLACEMENT, 2 OR MORE PIECES, METAL (E.G., STAINLESS STEEL OR COBALT CHROME), CERAMIC-LIKE MATERIAL (E.G., PYROCARBON) FOR SURGICAL IMPLANTATION, ANY SIZE,IMPL PIP DART",34303910,"1,933.75"
