HC CT SCAN DORSAL SP CONTRAST," $7,025.73 "
"HC CT ANGIO,UPPER EXTREM,COMBO"," $4,996.90 "
HC CT SCAN LUMBAR SPINE WO/W CONTRAST," $11,123.30 "
HC OR TIME 1ST 60 MIN LVL 1," $16,543.90 "
HC OR TIME 1ST 60 MIN LVL 2," $19,254.16 "
HC OR TIME 1ST 60 MIN LVL 3," $20,014.02 "
HC OR TIME 1ST 60 MIN LVL 4," $23,739.92 "
HC OR TIME 1ST 60 MIN LVL 5," $42,459.51 "
HC OR TIME EACH ADDL 15 MIN LVL 1," $2,540.78 "
HC OR TIME EACH ADDL 15 MIN LVL 2," $2,934.24 "
HC OR TIME EACH ADDL 15 MIN LVL 3," $3,617.52 "
HC OR TIME EACH ADDL 15 MIN LVL 4," $4,225.50 "
HC OR TIME EACH ADDL 15 MIN LVL 5," $6,432.50 "
HC REPR WND SMP FACE <2.5 CM, $848.06 
HC BX ANORECTAL WALL ANAL APPROACH," $6,924.60 "
HC APP SKN SUB TRNK/ARM/LEG TTL 100SQCM 1ST 25 SQCM," $7,056.05 "
HC APP SKN SUB HEAD/HND/FT/GNT TTL 100SQCM 1ST 25 SQCM," $7,056.05 "
HC BRONCHOSCOPY DIAG," $3,474.28 "
HC BRONCHOSCOPY DIAG W BRUSH," $3,474.28 "
HC BRONCHOSCOPY DIAG W LAVAGE," $5,275.60 "
HC BRONCHOSCOPY DIAG W BRONCH BX," $3,474.28 "
"HC BRONCHOSCOPY DIAG W LUNG BX, SINGLE LOBE"," $9,959.60 "
"HC BRONCHOSCOPY DIAG W NEEDLE ASP BX, SINGLE LOBE"," $11,281.80 "
"HC BRONCHOSCOPY DIAG W LUNG BX, EA DD LOBE"," $2,855.91 "
"HC BRONCHOSCOPY THERAPEUTIC ASPIR, INIT"," $3,474.28 "
"HC THROMBOLYTIC THERAPY, STROKE"," $2,060.67 "
HC PERCUT DRAIN/INJECT RENAL CYST," $4,709.90 "
"HC MYELOGRAPHY LUMBAR INJ, LUMBOSCRAL"," $4,956.43 "
"HC PLACE NEEDLE/CATH, VEIN (MIDLINE)", $340.23 
HC INCISION & DRAIN SKIN ABSCESS SIMPLE, $775.40 
HC INCISION & DRAIN SKIN ABSCESS COMPLIC," $1,369.62 "
HC INCISION & DRAIN PILONIDAL CYST SIMPL," $1,369.62 "
HC REMOVE FOREIGN BODY SIMPLE," $1,353.30 "
HC PUNCTURE DRAINAGE OF LESION, $511.75 
HC DEBRIDE SKIN SUB-Q TISS =<20 SQ CM," $1,353.30 "
HC DEBRIDE SKIN SUB-Q TISS MUSCLE =<20 SQ CM," $2,572.02 "
HC DEBRIDE SKIN SUB-Q TISS MUSCLE BONE =<20 SQ CM," $5,651.88 "
HC DEBRIDE SKIN SUB-Q TISS EACH ADD 20 SQ CM," $1,353.30 "
HC DEBRIDE SKIN SUB-Q TISS MUSCLE EA ADD 20 SQ CM, $847.71 
HC DEBRIDE SKIN SUB-Q TISS MUSC BN EA 20 SQ CM," $2,020.00 "
"HC TRIM BENIGN HYPERKERATOTIC SKIN LESION, SINGLE", $775.40 
"HC TRIM BENIGN HYPERKERATOTIC SKIN LESION,2-4", $895.40 
"HC BIOPSY OF SKIN LESION, SINGLE"," $1,578.85 "
"HC REMOVAL OF SKIN TAGS, UP TO 15", $351.53 
"HC DEBRIDEMENT OF NAILS, 1-5", $848.06 
"HC DEBRIDEMENT OF NAILS, 6 OR MORE", $848.06 
HC REMOVAL OF NAIL PLATE, $848.06 
HC DRAIN BLOOD FROM UNDER NAIL, $839.72 
HC REPR WND SMP BODY/SCALP/EXTR <2.5 CM," $1,033.11 "
HC REPR WND SMP BODY/SCALP/EXTR 2.6-7.5 CM," $1,218.16 "
HC REPR WND SMP BODY/SCALP/EXTR 7.6-12.5 CM," $1,403.21 "
HC REPR WND SMP BODY/SCALP/EXTR 12.6-20 CM," $1,588.26 "
HC REPR WND SMP BODY/SCALP/EXTR 20.1-30 CM, $873.00 
HC REPR WND SMP FACE 2.6-5.0 CM," $1,033.11 "
HC REPR WND SMP FACE 5.1-7.5 CM," $1,218.16 "
HC REPR WND SMP FACE 7.6-12.5 CM," $1,403.21 "
HC REPR WND INTRMD BODY/SCALP/EXTR <2.5 CM," $1,048.06 "
HC REPR WND INTRMD BODY/SCALP/EXTR 2.6-7.5 CM," $1,233.11 "
HC REPR WND INTRMD BODY/SCALP/EXTR 7.6-12.5 CM," $1,418.16 "
HC REPR WND INTRMD BODY/SCALP/EXTR 12.5-20 CM, $952.69 
HC REPR WND INTRMD NECK/HND/FT/GENT <2.5 CM," $1,048.06 "
HC REPR WND INTRMD NECK/HND/FT/GENT 2.6-7.5 CM," $1,533.11 "
HC REPR WND INTRMD NECK/HND/FT/GENT 12.5-20 CM," $2,036.23 "
HC REPR WND INTRMD FACE <2.5 CM," $1,333.11 "
HC REPR WND INTRMD FACE 2.6-5.0 CM," $1,518.16 "
HC REPR WND INTRMD FACE 5.1-7.5 CM, $820.97 
HC PREP WND TRK/AR/LG EA ADD 100 SQCM OR 1% PEDS," $1,458.00 "
"HC TREAT BURN 1ST DEGREE, INITIAL", $294.71 
HC DRESS/DEBRIDE BURN <5% TOTAL SM, $848.06 
HC CHEM CAUTERY GRANULATN TISSUE, $848.06 
HC EXPLORE WOUND EXTREMITY," $1,963.25 "
"HC BONE BIOPSY,TROCAR/NEEDLE DEEP"," $7,071.40 "
HC DRAIN/INJECT INTERMEDIATE JOINT/BURSA," $2,036.23 "
HC ASP/DRAIN LARGE JOINT/BURSA," $2,036.23 "
HC BIOPSY SOFT TISSUE NECK/CHEST," $2,923.33 "
HC DRAIN FINGER ABSCESS SIMPLE," $2,036.23 "
HC BIOPSY OF SOFT TISSUES," $3,767.92 "
HC REMOVE NASAL FB, $301.00 
HC INTUBATION ENDOTRACHEAL, $775.40 
HC CATHETER ASPIRATN NASOTRACH, $747.30 
HC PERQ LUNG/MEDIASTINUM BX," $2,825.94 "
HC TUBE THORACOSTOMY W DRAIN SYS," $1,931.32 "
HC THORACENTESIS NDL/CATH PLEURA ASP WO IMAG," $8,073.11 "
HC INSERT NON-TUNNEL CV CATH =>5 YR," $8,073.11 "
HC INSERT TUNNELED CV CATH W/O PORT OR PUMP," $9,441.86 "
HC INSERT PICC W/ SUB-Q PORT," $9,441.86 "
HC REPLACE PICC WO PORT/PUMP," $2,564.00 "
"HC INSERT NEEDLE,INTRAOSSEOUS INFUSN", $404.85 
"HC BONE MARROW BX, NEEDLE/TROCAR"," $7,071.40 "
"HC REPAIR LIP,FULL THICK,VERMILION"," $1,989.69 "
HC DRAINAGE OF GUM LESION, $848.06 
HC CHANGE GASTROSTOMY TUBE PERCUTANEOUS W/O GUIDE," $2,521.41 "
"HC I&D PERIANAL ABSCESS,SUPERFICIAL", $700.00 
HC INCISE EXTERNAL HEMORRHOID, $638.41 
HC NEEDLE BIOPSY LIVER," $4,709.90 "
HC ABDOM PARACENTESIS DX/THER W/O IMAGING GUIDANCE," $3,943.21 "
"HC PERCUT BIOPSY, ABDOMINAL MASS"," $4,709.90 "
HC REPLACE DUODENOSTOMY/JEJUNOSTOMY TUBE PERQ," $1,553.25 "
HC RENAL BIOPSY PERQ," $7,071.40 "
HC IRRIGATION OF BLADDER, $730.48 
"HC INSERT,NON-INDWELLING BLADDER CATHETER", $244.82 
"HC INSERT,TEMP INDWELLING BLAD CATH,SIMPLE", $692.46 
"HC CHANGE OF BLADDER TUBE,SIMPLE", $574.81 
HC I&D OF VULVA/PERINEUM ABSCESS," $2,036.23 "
HC I&D BARTHOLIN GLAND ABSCESS, $980.72 
"HC BIOPSY OF THYROID,PERCUT"," $2,403.20 "
"HC SPINAL PUNCTURE,LUMBAR,DIAGNOSTIC"," $2,925.85 "
"HC REMV F.B.,EYE,SUPERF CONJUNC", $411.00 
"HC REMV F.B.,EYE,CORNEA,NO SLIT", $848.06 
"HC REMV F.B.,EYE,CORNEA,SLIT LAMP", $442.81 
HC DRAINAGE OF EYELID ABSCESS, $804.14 
HC REMV EXT CANAL FOREIGN BODY, $848.06 
HC REMOVAL IMPACTED CERUMEN INSTRUMENTATION UNILAT, $248.00 
HC DEBRIDEMENT OPEN WOUND 20 SQ CM<," $1,267.95 "
HC DEBRIDEMENT OPEN WOUND EA ADDL 20 SQ CM," $1,267.95 "
HC INJECT TRIGGER POINT1-2 MUSCLE," $2,036.23 "
"HC COMPLEX DRAINAGE, WOUND"," $3,472.16 "
HC REMOVAL TUNNELED CV CATH W/O SUBQ PORT OR PUMP," $6,279.72 "
HC BRONCHOSCOPY COMPUTER ASSIST/IMAGE GUIDED NAVIGAT," $4,213.41 "
HC BRONCHOSCOPY THERMOPLASTY =>2 LOBES," $7,023.02 "
HC INSERT PICC W/O SUB-Q PORT," $8,073.11 "
"HC PLACE NEPROSTOMY CATH, PERQ W IMG"," $8,223.30 "
HC BONE MARROW ASPIRATE &BIOPSY, $876.00 
HC DRAINAGE OF PALMAR BURSA SINGLE BURSA," $6,749.70 "
HC DIAGNOSTIC BONE MARROW BIOPSIES & ASPIRATIONS," $6,740.15 "
HC ANESTHESIA 1ST 60 MIN GENERAL," $6,119.54 "
HC ANESTHESIA ADDL 15 MIN GENERAL," $1,211.38 "
HC BLOCK/SPINAL 1ST 60 MIN," $1,500.00 "
HC BLOCK/SPINAL ADDL 15 MIN, $410.09 
HC MAC 1ST 60 MIN," $1,165.56 "
HC MAC ADDL 15 MIN, $410.09 
HC LOCAL 1ST 60 MIN," $1,165.56 "
HC MODER SEDATE SAME PHYS/QHP <5 YRS INIT 15 MIN, $848.47 
HC MODER SEDATE SAME PHYS/QHP 5/>YRS INIT 15 MIN, $848.47 
HC MODER SEDATE SAME PHYS/QHP EACH ADDL 15 MIN, $589.96 
"HC INJ NERV BLCK,OTHR PERIPH NERV"," $2,036.23 "
HC MODERATE SEDATJ DIFF PHYS/QHP 5/>YRS INIT 15 MIN, $823.26 
"HC CRYOPRECIPITATE, PER UNIT", $283.00 
"HC RBC LEUKOCYTES REDUCED, PER UNIT"," $1,131.26 "
"HC RED BLOOD CELLS, PER UNIT", $980.72 
"HC PLATELETS PHERESIS LEUKOCYTES REDUCED, PER UNIT"," $5,247.07 "
"HC PLATELETS PHRSIS LEUKO REDUCE IRRADIAT, EA UNIT"," $2,790.42 "
"HC RBC LEUKOREDUCED IRRADIATED, PER UNIT"," $14,628.20 "
"HC PLASMA CRYOPRECIPITATE REDUCED, PER UNIT", $839.72 
"HC FRESH FROZEN PLASMA IN 8-24HR, PER UNIT"," $1,019.12 "
HC LAB PROCESSING FEE, $25.00 
HC BLOOD TRANSFUSION SERVICE," $1,745.70 "
HC PERQ DEV PLACE BREAST LOC 1ST LES W MAMMO GUID," $4,803.14 "
HC PERQ DEV PLACE BREAST LOC 1ST LES W MAMMO GUID," $2,401.57 "
HC MAMMOGRAPHY; UNILATERAL, $743.80 
HC MAMMOGRAPHY; BILATERAL, $906.90 
HC ABDOM PARACENTESIS DX/THER W IMAGING GUIDANCE," $2,002.50 "
"HC US, HEAD/NECK TISSUES,REAL TIME"," $3,196.57 "
"HC US, CHEST,REAL TIME", $892.41 
"HC US, BREAST UNILAT COMPLETE"," $1,953.60 "
"HC US, BREAST UNILAT COMPLETE", $976.80 
"HC US, ABDOM,B-SCAN &/OR REAL TIME,COMPLETE"," $1,910.85 "
"HC US, ABDOMEN LIMITED"," $1,260.85 "
"HC US,RETROPERIT, B-SCAN/REAL TIME,COMPLETE"," $1,810.40 "
"HC US, RETROPERITNL ABD, LTD"," $1,354.54 "
"HC US, OB < 14 WKS, SINGLE FETUS", $851.00 
"HC US, OB < 14 WKS, ADD'L FETUS"," $2,107.62 "
"HC US, OB >/= 14 WKS, SNGL FETUS"," $1,960.61 "
"HC US,PREGNANT UTERUS,LIMITED, 1/> FETUSES"," $2,175.14 "
"HC US,PREGNANT UTERUS,TRANSVAGINAL"," $2,267.34 "
"HC ULTRASOUND,TRANSVAGINAL", $810.00 
"HC ULTRASOUND,PELVIC (NONOBSTETRIC)"," $3,633.53 "
HC US PELVIS NONOBST LIMITED/FU," $1,376.27 "
"HC ULTRASOUND,SCROTUM & CONTENTS"," $2,070.61 "
HC US EXTREMITY NON VASCULAR REAL TIME COMP," $1,166.69 "
HC US EXTREMITY NON VASCULAR REAL TIME LTD, $875.02 
"HC US GUIDE, VASCULAR ACCESS"," $1,514.75 "
HC US GUIDE FOR NEEDLE PLACEMENT," $2,601.85 "
HC BX BREAST W DEVICE US GUIDE 1ST LESION," $11,303.76 "
HC BX BREAST W DEVICE US GUIDE 1ST LESION," $5,651.88 "
"HC US GUID,COMP REPAIR,PSEUDO-ANEUR/AV FIST"," $2,690.50 "
HC ULTRASOUND BREAST UNILAT LIMITED," $1,925.50 "
HC ULTRASOUND BREAST UNILAT LIMITED, $962.75 
"HC MAMMOGRAM, SCREENING", $276.33 
HC CAD SCREENING MAMMO, $208.42 
HC WITHDRAWAL OF ARTERIAL BLOOD, $455.90 
"HC VENT MANAGEMENT, INPATIENT, INITIAL DAY"," $4,839.17 "
"HC POS AIRWAY PRESSURE, CPAP"," $4,623.50 "
"HC CHEST WALL MANIPULATION,INITIAL", $377.38 
HC THERAPEUTIC PROCD STRG ENDUR, $455.90 
"HC VENT MANAGEMENT, INPAT/OBSER, EA SUBQ DAY"," $4,337.54 "
"HC CHEST WALL MANIPULATION, SUBSEQUENT", $288.61 
HC AIRWAY INHALATION TREATMENT, $769.71 
"HC HYPERBARIC OXY, FULL BODY, PER 30 MIN"," $1,277.31 "
"HC THERAPEUTIC EXERCISES, EA 15 MIN", $223.79 
"HC GAIT TRAIN THERAPY, EA 15 MIN", $210.80 
HC THERAPEUT ACTVITY DIRECT PT CONTACT EA 15 MIN, $201.45 
"HC NEUROMUSC REEDUCAT,1+ AREAS, EA 15 MIN", $159.00 
HC PHYSICAL PERFORMANCE TEST EA 15 MIN, $242.02 
HC CONTRAST BATH THERAPY EA 15 MIN, $122.59 
HC SELF CARE MNGMENT TRAIN EA 15 MIN, $245.91 
HC MANUAL THERAPY 1/> REGIONS EA 15 MIN, $354.01 
HC MASSAGE THERAPY EA 15 MIN, $161.99 
HC PARAFFIN BATH THERAPY, $248.45 
HC ULTRASOUND THERAPY EA 15 MIN, $265.53 
HC ELEC STIM OTHER THAN WOUND, $276.48 
HC ELECTRICAL STIMULATION EA 15 MIN, $145.00 
HC ORTHOTIC MGMT AND TRAIN  INITIAL ENCTR EA 15 MIN, $264.00 
HC SENSORY INTEGRATION EA 15 MIN, $136.74 
HC GROUP THERAPEUTIC PROCEDURES, $66.73 
HC WHEELCHAIR MNGMENT TRAIN EA 15 MIN, $217.78 
HC WHIRLPOOL THERAPY, $351.23 
HC ELECT STIMUL UNATTND FOR ULCERS, $215.99 
HC MECHANICAL TRACTION THERAPY, $310.56 
HC BIOFEEDBACK TRAIN ANY METH, $168.63 
"HC THERAPEUTIC EXERCISES COMPLEX, EA 15 MIN", $223.79 
"HC GAIT TRAIN THERAPY COMPLEX, EA 15 MIN", $210.80 
"HC PHYS THERAPY EVALUATION, 15 MIN", $319.41 
"HC PHYS THRP RE-EVAL, 20 MIN", $262.62 
"HC PHYS THRP EVAL, LOW COMPLEXITY, 20 MIN", $211.17 
"HC PHYS THRP EVAL, MODERATE COMPLEXITY, 30 MIN", $285.73 
"HC PHYS THRP EVAL, HIGH COMPLEXITY, 45 MIN", $360.28 
HC THERAPEUTIC IVNTJ W/FOCUS ON COGNITIVE FUNCTION, $277.50 
"HC OCCUP THRP RE-EVAL, 30 MIN", $148.12 
"HC OCCUP THRP EVAL,  LOW COMPLEXITY, 30 MIN", $250.00 
"HC OCCUP THRP EVAL, MODERATE COMPLEXITY, 45 MIN", $300.00 
"HC SPEECH/HEARING THERAPY INDIVIDUAL, 15 MIN", $565.21 
"HC SPEECH/HEARING THERAPY INDIVIDUAL, 30 MIN", $643.00 
"HC SPEECH/HEARING THERAPY INDIVIDUAL, 45 MIN", $764.10 
"HC SPEECH/HEARING THERAPY INDIVIDUAL, 60 MIN"," $1,018.80 "
"HC ORAL FUNCTION THERAPY, 15 MIN", $155.84 
"HC ORAL FUNCTION THERAPY, 30 MIN", $205.84 
"HC ORAL FUNCTION THERAPY, 45 MIN", $250.00 
"HC ST EVAL SPEECH SOUND PROD LANGUAG COMPRHNS, 15 MIN", $906.93 
"HC ST EVAL SPEECH SOUND PROD LANGUAG COMPRHNS, 30 MIN", $193.70 
"HC EVAL,ORAL & PHARYNGEAL SWALLOW FUNCTION, 15 MIN", $195.33 
"HC EVAL,ORAL & PHARYNGEAL SWALLOW FUNCTION, 30 MIN", $280.84 
"HC EVAL,ORAL & PHARYNGEAL SWALLOW FUNCTION, 45 MIN", $405.84 
"HC EVAL,SWALLOW FUNCTION,CINE/VIDEO RECORD, 30 MIN", $449.68 
"HC EVAL,SWALLOW FUNCTION,CINE/VIDEO RECORD, 45 MIN", $299.64 
HC ED LEVEL 1, $690.87 
HC ED LEVEL 2, $622.30 
HC ED LEVEL 3," $1,179.46 "
HC ED LEVEL 4," $1,771.51 "
HC ED LEVEL 5," $3,962.43 "
"HC CRITICAL CARE, E/M 30-74 MINUTES"," $5,439.33 "
"HC CRITICAL CARE, ADDL 30 MIN"," $1,666.00 "
HC BREATHING CAPACITY TEST," $1,516.81 "
HC EVAL OF BRONCHOSPASM, $738.00 
HC GAS DILUT/WASHOUT LUNG VOL W/WO DISTRB VENT&VOL, $741.71 
HC DIFFUSING CAPACITY, $442.00 
"HC NONINVASV OXYGEN SATUR,MULTIPLE", $234.07 
"HC NONINVASV OXYGEN SATUT,CONTINUOUS", $775.40 
HC NONINVASV OXYGEN SATUR;SINGLE, $140.42 
HC EXHALED CARBON DIOXIDE TEST," $1,101.75 "
HC HEART/LUNG RESUSCITATION (CPR)," $1,322.10 "
HC TRANSTELEPHONIC RHYTHM STRIP PACEMAKER EVAL, $246.55 
HC TEMPORARY EXTERNAL PACING," $2,802.54 "
"HC CARDIOVERSION, ELECTIVE;EXTERN"," $2,802.54 "
HC INSERT VENTR PM W TRANSVENOUS ELECTRODE," $37,820.20 "
HC INSERT ART & VENTR PM W TRANSVENOUS ELECTROD," $37,820.20 "
HC INSERT TEMP PM/ELECTRODE SINGLE CHMBR," $30,090.55 "
HC INSERT PULSE GENER SINGLE CHMBR," $30,090.55 "
HC INSERT PULSE GENER DUAL CHMBR," $37,820.20 "
HC REPOSITION TRANSVENOUS PM/ELECTRODE," $5,175.06 "
HC INSRT SINGLE TRANSVEN ELECTROD/PM/DEFIB," $8,398.00 "
HC RELOCATE SKIN POCKET FOR PACEMAKER," $3,949.41 "
HC REMVL PERM PM PLSE GEN W/REPL PLSE GEN SNGL LD," $30,090.55 "
HC REMVL PERM PM PLS GEN W/REPL PLSE GEN 2 LD SYS," $37,820.20 "
HC REMV PERM PACER GENERATOR," $33,484.25 "
HC REMV TRANSVEN PACER ELECTRODE SINGLE LEAD," $4,657.90 "
"HC REMV TRANSVEN PACER ELECTRODE,2 LEAD"," $4,924.39 "
"HC INSERT PULSE GEN,SNGL/DUAL"," $27,320.61 "
"HC RMV PACER/ELECTRD,TRANSVEN EXTRCT"," $4,867.47 "
HC INSERT/RPLACMNT AICD W LEAD SING/DUAL," $99,469.34 "
HC REM PAC CVDFB PLSE GEN &REPL PLSE GEN SNGL LEAD," $75,790.09 "
HC REM PAC CVDFB PLSE GEN &REPL PLSE GEN DUAL LEAD," $75,790.09 "
HC REM PAC CVDFB PLS GEN &REPL PLSE GEN MULTI LEAD," $99,469.34 "
HC IMPLANTATION PT-ACTIVATED CARDIAC EVENT RECORDR," $33,484.25 "
HC INSJ PERQ VAD W/IMAGING ARTERY ACCESS ONLY," $11,380.00 "
HC REMOVAL PERCUTANEOUS VAD DIFFERENT SESSION," $4,951.19 "
HC INSERT INTRA-AORTIC BALLOON ASST DEVICE," $18,976.40 "
HC RMV AORTIC BALLOON DEVICE," $1,814.82 "
HC PLC CATH CAROT/VERT ART," $3,723.00 "
HC PLC CATH EXTREM ARTERY," $4,337.33 "
HC PLC CATH AORTA VIA TRANSLUMBAR," $1,696.00 "
HC PLC CATH AORTA," $4,201.88 "
"HC PLC CATH SELECTIVE ART,NECK"," $1,868.70 "
HC SLCTV CATH CAROTID/INNOM ART ANGIO XTRCRANL ART," $20,875.32 "
HC SLCTV CATH CAROTD/INNOM ART ANGIO INTRCRANL ART," $25,181.12 "
HC SLCTV CATH INTRNL CAROTD ART ANGIO INTRCRNL ART," $21,324.80 "
HC SLCTV CATH INTRNL CAROTD ART ANGIO INTRCRNL ART," $25,181.12 "
HC SLCTV CATH SUBCLAVIAN ART ANGIO VERTEBRAL ART," $20,875.32 "
HC SLCTV CATH VERTEBRAL ART ANGIO VERTEBRAL ARTERY," $25,181.12 "
"HC PLACE CATH SELECT ART,ABD/PEL"," $5,911.04 "
"HC PLACE CATH SUBSELECT ART,ABD/PEL"," $6,180.85 "
"HC PLACE CATH SUBSUBSELECT ART,ABD/PEL"," $2,995.93 "
HC SLCTV CATH 1STORD W/WO ART PUNCT/FLUORO/S&I UNI," $20,875.32 "
HC SLCTV CATH 1STORD W/WO ART PUNCT/FLUOR/S&I BILA," $20,875.32 "
HC SUPSLCTV CATH 2ND+ORD RENL&ACCES ARTER/S&I BILA," $20,875.32 "
HC REMVL PERM PM PLS GEN W/REPL PLSE GEN MULT LD SYS," $60,743.20 "
"HC INSERT CANNULA,VEIN-VEIN"," $5,096.09 "
"HC PRIM PERC MECH THROMBECTOMY, ARTERIAL"," $8,272.88 "
HC INSERT INTRVAS VC FILTR W VASC ACS VSSL RS&I," $25,181.12 "
HC PERQ TRANSCATH RTRVL INTRVAS FB W IMG," $5,536.40 "
HC REVASC ILIAC ARTANGIOPLASTY INIT VSSL," $28,368.60 "
HC REVASC ILIAC ART ANGIOPL/STNT INIT VSSL," $38,627.05 "
HC REVASC ILIAC ART ANGIOPL EA ADD VESSEL," $8,069.58 "
HC REVASC ILIAC ART ANGIOPLASTY/STNT EA ADD VSSL," $15,202.23 "
HC REVASC FEM/POP ART ANGIOPLASTY," $28,368.60 "
HC REVASC FEM/POP ART ANGIOPL/STNT," $38,627.05 "
HC REVASC FEM/POP ART ANGIOPL/STNT/ATHERECTOMY," $27,969.18 "
HC REVASC TIBIAL/PERON ART ANGIOPL INIT," $38,627.05 "
HC OPEN/PERQ PLACEMENT INTRAVASCULAR STENT INITIAL," $38,627.05 "
HC OPEN/PERQ PLACEMENT INTRAVASCULAR STENT EA ADDL," $20,710.00 "
HC PRQ TRLUML CORONARY ANGIOPLASTY ONE ART/BRANCH," $25,425.00 "
HC PRQ TRLUML CORONARY ANGIOPLASTY ADDL BRANCH," $17,021.16 "
HC PRQ TRLUML CORONARY STENT W/ANGIO ONE ART/BRNCH," $38,627.05 "
HC PRQ TRLUML CORONRY STENT W/ANGIO ADDL ART/BRNCH," $23,176.23 "
HC PRQ TRLUML CORONRY STNT/ATH/ANGIO ONE ART/BRNCH," $53,836.51 "
HC PRQ TRANSLUMINAL CORONRY MECHANICL THROMBECTOMY," $12,804.25 "
"HC R&L HEART CATH INJ VETRICULOGRAPHY, RS/I"," $20,196.48 "
HC CATH PLC/COR ANGIO RS/I," $20,373.77 "
HC CATH PLC/COR ANGIO RS/I BYPASS ANGIO," $25,025.64 "
HC CATH PLC/COR ANGIO RS/I W L HRT VENTRICULOGRPHY," $14,068.00 "
"HC CATH PLC/COR ANGIO RS/I BYPSS ANGIO,W L VENTRIC"," $14,068.00 "
HC CATH PLC/COR ANGIO RS/I R&L HRT CATH L VENTRIC," $14,068.00 "
HC INJ SUPRAVALVULAR AORTOGRAPHY DURING HEART CATH," $4,793.00 "
HC HEART FLOW RESERV MEASURE INIT VESSL," $12,641.71 "
HC HEART FLOW RESERV MEASURE EA ADD VESSL," $4,909.75 "
HC PERC DRUG-EL COR STENT SING," $38,627.05 "
HC PERC DRUG-EL COR STENT BRAN," $21,092.05 "
HC PRQ DRUG ELUTING COR STENT ATHER S," $53,836.51 "
HC PRQ DRUG ELUTING COR REVASC T CABG S," $38,627.05 "
HC ENDOVASC VISCER AORTA REHC FENEST 4+ ENDOGRAFT, $972.50 
HC REVASC FEM/POP ART ANGIOPL/ATHERECTOMY," $12,930.04 "
HC REVASC TIBIAL/PERON ART ANGIOPL/ATHERECT INIT," $73,060.85 "
HC RMVL IMPLANTABLE PT-ACTIVATED CAR EVENT RECORDER," $5,651.88 "
HC TRLML BLLN ANGIOP OPEN/PERQ IMG S&I INIT ART," $24,115.80 "
HC TRLML BLLN ANGIOP OPEN/PERQ IMG S&I EA ADDL ART," $14,469.48 "
"HC CARDIAC STRESS TST,TRACING ONLY (93017)"," $2,340.00 "
"HC ECHO HEART XTHORACIC,COMPLETE W DOPPLER"," $3,036.41 "
"HC ECHO HEART XTHORACIC,LIMITED", $951.00 
"HC ECHO HEART,TRANSESOPHAGEAL,COMPLETE"," $7,524.46 "
HC DOPPLER COLOR FLOW VELOCITY MAP (93325)," $1,027.20 "
HC 2D TTE W OR W/O FOL W/CON COMPLETE," $3,036.41 "
"HC MRI, CHEST"," $6,746.86 "
HC MRI CHEST W/CONTRAST," $8,552.33 "
"HC MRI, PELVIS, W/O CONTRAST"," $10,135.20 "
"HC MRI, PELVIS, COMBO"," $13,309.04 "
HC MRI UPPER EXTREMITY W/O CONTRAST," $14,628.20 "
HC MRI UPPER EXTREM WO/W CONTRAST," $21,948.12 "
HC MRI JOINT UPPER EXTREM WO CONTRAST," $20,284.53 "
HC MRI JOINT UPPER EXTREM W/CONTRAST," $20,515.04 "
"HC MRI, JOINT UPPER EXTREM COMBO"," $22,312.98 "
"HC MRI, LOWER EXTREM"," $18,400.15 "
HC MRI LOWER EXTREM W/CONTRAST," $19,817.58 "
HC MRI LOWER EXTR W/O CONTRAST F/U BY CONTRAST," $20,603.08 "
"HC MRI LOWER EXTREM JT, W/O CONTRAST"," $14,562.81 "
HC MRI JOINT OF LEG W/CONTRAST," $19,091.97 "
HC MRI JOINT OF LEG. COMBO," $20,284.53 "
HC MRI ABDOMEN WO CONTRAST," $8,829.95 "
HC MRI ABDOMEN WO/W CONTRAST," $10,690.87 "
HC UNLISTED MR PROCEDURE," $5,240.83 "
"HC MRI, FACE, NECK"," $9,646.17 "
"HC MRI, FACE, NECK, COMBO"," $13,112.18 "
HC MRI BRAIN," $6,636.72 "
HC MRI BRAIN CONTRAST," $8,947.48 "
HC MRI BRAIN COMBO," $16,198.60 "
"HC MRI, FACE, NECK W/CONTRAST"," $12,785.29 "
"HC MRI, CERV SPINE"," $12,111.98 "
"HC MRI, DORSAL SPINE"," $10,470.09 "
"HC MRI, LUMBAR SPINE"," $11,369.79 "
"HC MRI, CERV SPINE COMBO"," $13,476.38 "
"HC MRI, DORSAL SPINE COMBO"," $12,779.55 "
"HC MRI, LUMBAR SPINE COMBO"," $14,836.28 "
HC MRI LUMBAR SPINE CONTRAST," $11,158.09 "
"HC MR ANGIO, HEAD"," $6,568.75 "
"HC MR ANGIO, NECK"," $6,472.26 "
HC PACU 1ST 60 MIN," $5,000.00 "
HC PACU ADDL 15 MIN," $1,250.00 "
"HC ELECTROCARDIOGRAM, TRACING", $647.98 
"HC EEG,W/AWAKE & DROWSY RECORD"," $1,315.79 "
"HC EEG,W/AWAKE & ASLEEP RECORD"," $1,606.00 "
"HC EEG,COMA/SLEEP RECORD ONLY"," $1,294.69 "
HC MULTIPLE SLEEP LATENCY TEST," $3,552.38 "
HC SLP STDY UNATTND SIMUL RCORD HR/O2 SAT/RESP FLW/RESP EFF," $1,286.35 "
HC POLYSOM 6/>YRS SLEEP 4/> ADDL PARAM ATTND," $7,287.67 "
HC POLYSOM 6/>YRS SLEEP W/CPAP 4/> ADDL PARAM ATTND," $8,857.34 "
"HC EEG MONITORING/COMPUTER, EA 24 HOURS, UNATTENDED"," $3,350.27 "
HC MONITOR ID& LATERALIZATION SEIZURE FOCUS EEG," $3,113.54 "
HC ESOPHAGOSCOPY FLEXIBLE TRANSORAL DIAGNOSTIC," $2,890.00 "
HC ESOPHAGOSCOPY FLX TRANSORAL WITH BIOPSY," $2,890.00 "
HC ESOPHAGOSCOPY FLEXIBLE W BLEEDING CONTROL," $3,575.28 "
HC ESOPHAGOSCOPY FLX TRANSORAL LESION ABLATION," $9,575.75 "
HC EGD TRANSORAL DIAGNOSTIC," $2,890.00 "
HC ESOPHAGOGASTRODUODENOSCOPY SUBMUCOSAL INJECTION," $2,890.00 "
HC EGD TRANSORAL BIOPSY SINGLE/MULTIPLE," $2,890.00 "
HC EGD INJECTION SCLEROSIS ESOPHGL/GASTRIC VARICES," $2,890.00 "
HC EGD BAND LIGATION ESOPHGEAL/GASTRIC VARICES," $3,575.28 "
HC EGD DILATION GASTRIC/DUODENAL STRICTURE," $3,575.28 "
HC EGD PERCUTANEOUS PLACEMENT GASTROSTOMY TUBE," $3,575.28 "
HC EGD FLEXIBLE FOREIGN BODY REMOVAL," $2,890.00 "
HC EGD INSERT GUIDE WIRE DILATOR PASSAGE ESOPHAGUS," $2,890.00 "
HC EGD BALLOON DILATION ESOPHAGUS <30 MM DIAM," $3,575.28 "
HC EGD REMOVAL TUMOR POLYP/OTHER LESION SNARE TECH," $3,575.28 "
HC EGD TRANSORAL CONTROL BLEEDING ANY METHOD," $3,575.28 "
HC ERCP DX COLLECTION SPECIMEN BRUSHING/WASHING," $4,793.55 "
"HC ERCP,BIOPSY"," $4,742.61 "
"HC ERCP,SPHINCTEROTOMY"," $4,828.96 "
HC ERCP REMOV CALCULI/DEBRIS BILIARY/PANCREAS DUCT," $4,742.61 "
HC EGD ENDOSCOPIC STENT PLACEMENT W/WIRE& DILATION," $6,618.67 "
HC EGD ABLATE TUMOR POLYP/LESION W/DILATION& WIRE," $3,575.28 "
HC ENDOSCOPIC PAPILLA CANNULATION BILE/PANCREATIC," $4,497.60 "
HC ERCP STENT PLACEMENT BILIARY/PANCREATIC DUCT," $6,618.67 "
HC ERCP REMOV FOREIGN BODY/STNT BILIARY/PANC DUCT," $5,081.67 "
HC ERCP BILIARY/PANC DUCT STENT EXCHNGE W/DIL&WIRE," $6,618.67 "
"HC SIGMOIDOSCOPY,DIAGNOSTIC"," $2,637.09 "
"HC SIGMOIDOSCOPY,BIOPSY"," $2,637.09 "
"HC COLONOSCOPY,DIAGNOSTIC"," $2,904.80 "
"HC COLONOSCOPY,BIOPSY"," $3,002.69 "
"HC COLONOSCPY,FLEX,W/DIR SUBMUC INJECT"," $2,904.80 "
"HC COLONOSCOPY,FLEX,W/CONTROL, BLEEDING"," $2,904.80 "
"HC COLONOSCOPY,REMV LESN,FORCEP/CAUTERY"," $3,000.00 "
"HC COLONOSCOPY,REMV LESN,SNARE"," $3,219.03 "
"HC COLONOSCOPY,ABLATE LESION"," $2,970.50 "
HC COLON MOTILITY STUDY MIN 6 HR CONT RECORD W I&R," $2,351.25 "
"HC SIGMOIDOSCOPY,REMVL F.B."," $2,904.80 "
HC SIGMOIDOSCOPY FLEX W BAND LIGATION," $2,904.80 "
HC COLONOSCOPY FLEX W BAND LIGATION," $3,056.69 "
HC GERD TST W/ MUCOS PH ELECTROD," $2,541.16 "
"HC COLORECTAL CANCER SCREEN, FLEX SIGMOIDSCOPE"," $2,637.09 "
"HC COLORECTAL CANCER SCREEN, COLONOSCOPY HIGH RISK"," $2,904.80 "
"HC COLORECTAL CANCER SCRN, COLONOSCOPY NOT HIGH RISK"," $2,904.80 "
HC ESOPHAGOSCOPY FLEX REMOVAL FOREIGN BODY," $3,575.28 "
HC EGD FLEX ESOPHAGUS BALLOON DILATION =>30 MM," $3,575.28 "
HC EDG FLEX INTRALUMINAL TUBE/CATHETER INSERTION," $2,890.00 "
HC SMALL BOWEL ENDO ABLATE LESN," $3,575.28 "
HC COLONOSCOPY THRU STOMA WASH/BRUSH," $2,904.80 "
HC SIGMOIDOSCOPY FLEX LESION/TUMOR REMOV SNARE," $2,637.09 "
HC SIGMOIDOSCOPY FLEX DIR SUBMUC INJECT," $2,637.09 "
HC COLONOSCOPY FLEX BLLN DILATE," $2,904.80 "
HC FECAL MICROBIOTA PREP AND INSTILLATION," $2,235.82 "
HC OFFICE OUTPATIENT NEW 20 MIN, $876.73 
HC OFFICE OUTPATIENT NEW 45 MIN," $1,523.05 "
HC OFFICE OUTPATIENT NEW 60 MIN," $2,083.88 "
HC OFFICE OUTPATIENT F/U VISIT 5 MIN, $711.92 
HC OFFICE OUTPATIENT F/U VISIT 10 MIN, $875.61 
HC OFFICE OUTPATIENT F/U VISIT 15 MIN, $875.61 
HC OFFICE OUTPATIENT F/U VISIT 25 MIN," $1,149.40 "
HC OFFICE OUTPATIENT F/U VISIT 40 MIN," $1,591.88 "
HC CLSD TREAT CLAVICLE FX WO MANIP, $668.59 
HC CLSD TREAT SHLDR DISLOC W MANIP WO ANES," $1,723.30 "
HC CLSD TREAT MID HUMERUS FX W MANIP," $5,482.25 "
HC CLSD TREAT ELBOW DISLOC WO ANES, $740.00 
HC CLSD TREAT ULNAR FX PROX END W MANIP," $5,482.25 "
HC CLSD TREAT RAD/ULNA SHAFT FX W MANIP," $1,416.21 "
HC CLSD TREAT DISTL RAD/ULNA FX W MANIP," $1,475.87 "
HC CLSD TREAT MC-P DISLOC W MANIP WO ANES, $620.00 
HC CLSD TREAT FINGR ARTICULAR FX W MANIP EA," $5,482.25 "
HC CLSD TREAT DIST FINGR FX W MANIP EA, $681.50 
HC CLSD TREAT IP JNT DISLOC W MANIP WO ANES," $1,723.30 "
HC CLSD TREAT POST HIP ARTHRPLAS DISLOC W ANES, $934.92 
HC CLSD TREAT PATELLR DISLOC WO ANES, $763.00 
HC CLSD TREAT DIST FIBULA FX W MANIP," $2,375.00 "
HC CLSD TREAT WEIGHT BEAR DIST TIB W MANIP," $2,773.14 "
HC CLSD TREAT ANKLE DISLOC WO ANES," $1,008.12 "
"HC CLSD TREAT I-P JT,TOE DISLOC WO ANES"," $2,036.23 "
HC APPLY LONG ARM SPLINT," $1,192.40 "
HC APPLY FOREARM SPLINT STATIC, $911.80 
HC APPLY FINGER SPLINT STATIC, $559.40 
HC STRAPPING SHOULDER, $254.67 
HC APPLY LONG LEG SPLINT," $1,192.40 "
HC APPLY LOWER LEG SPLINT," $1,192.40 "
HC STRAPPING UNNA BOOT," $1,192.40 "
HC CONTROL NOSE BLEED ANTER SIMPLE, $911.80 
HC CONTROL NOSE BLEED POST PACK/CAUT INIT," $1,292.90 "
HC DECLOT THROMBOLYTIC AGENT IMPLANT DEV/CATH, $702.59 
"HC NEG PRESS WOUND TX W DME, </= 50 CM", $898.39 
"HC NEG PRESS WOUND TX W DME, > 50 CM"," $1,272.75 "
HC APPLY MULTLAY COMPRS LWR LEG," $1,192.40 "
"HC NEG PRESS WOUND TX W NON-DME, </= 50 CM"," $1,723.30 "
HC REMOVE IMPACTED EAR WAX UNI, $559.40 
"HC IMMUNIZ ADMIN, INJ, INIT VAC", $221.32 
"HC IMMUNIZ ADMIN, INJ, EA AD VAC", $221.32 
HC ADMIN INFLUENZA VIRUS VAC, $365.86 
HC ADMIN PNEUMOCOCCAL VAC, $340.12 
HC ADMIN HEP B VAC, $221.32 
HC ER / UNSCHEDULED DIALYSIS FOR ESRD," $3,584.74 "
HC HEMODIALYSIS W SING EVAL," $4,117.07 "
HC DIALYSIS OTHER THAN HEMO W SING EVAL (CAPD), $991.22 
HC DIALYSIS OTHER THAN HEMO W SING EVAL (CCPD)," $2,458.89 "
HC PSYCH DIAGNOSTIC EVALUATION, $353.94 
"HC DUPLEX SCAN EXTRACRANIAL,BILAT"," $2,602.93 "
"HC NON-INV PHYSIOLOGIC STD EXTREM ART 1-2 LVL, LMT", $791.53 
"HC NON-INV PHYSIOLOGIC STD EXTREM ART 3 LVLS, COMP"," $1,905.23 "
HC DUPLEX LO EXTREM ART UNILAT/LTD, $948.18 
HC DUPLEX UP EXTREM ART BILAT," $1,735.00 "
HC DUPLEX UP EXTREM ART UNILAT/LTD," $1,078.96 "
"HC DUPLEX EXTREM VENOUS,BILAT"," $1,571.05 "
"HC DUPLEX EXTREM VENOUS,UNI OR LTD"," $1,107.75 "
"HC DUPLEX ABD/PEL VASC STUDY,COMPLETE"," $1,878.40 "
"HC DUPLEX SCAN EXTRACRANIAL,LIMITED"," $2,303.70 "
HC DUPLEX LO EXTREM ART BILAT," $2,303.70 "
"HC INJ, THERAP/PROPH/DIAGN, IM OR SUBCUT", $465.61 
"HC INJ, THERAP/PROPH/DIAGN, IV PUSH INIT DX", $498.20 
"HC INJ, THERAP/PROPH/DIAGN, IV PUSH EA ADD NEW DX", $353.88 
"HC INJ, THERAP/PROPH/DIAGN, IV PUSH EA ADD SAME DX", $363.66 
HC PHLEBOTOMY THERAPUTIC, $455.90 
