MS790,"EXTREME IMMATURITY OR RESPIRATORY DISTRESS SYNDROME, NEONATE","$7,013 "
MS791,PREMATURITY W MAJOR PROBLEMS,"$24,988 "
MS792,PREMATURITY W/O MAJOR PROBLEMS,"$15,743 "
MS793,FULL TERM NEONATE W MAJOR PROBLEMS,"$11,968 "
MS794,NEONATE W OTHER SIGNIFICANT PROBLEMS,"$5,182 "
MS795,NORMAL NEWBORN,"$4,314 "
MS799,SPLENECTOMY W MCC,"$156,336 "
MS801,SPLENECTOMY W/O CC/MCC,"$35,687 "
MS802,OTHER O.R. PROC OF THE BLOOD & BLOOD FORMING ORGANS W MCC,"$81,624 "
MS803,OTHER O.R. PROC OF THE BLOOD & BLOOD FORMING ORGANS W CC,"$32,480 "
MS804,OTHER O.R. PROC OF THE BLOOD & BLOOD FORMING ORGANS W/O CC/MCC,"$61,113 "
MS809,MAJOR HEMATOL/IMMUN DIAG EXC SICKLE CELL CRISIS & COAGUL W CC,"$28,201 "
MS810,MAJOR HEMATOL/IMMUN DIAG EXC SICKLE CELL CRISIS & COAGUL W/O CC/MCC,"$16,544 "
MS811,RED BLOOD CELL DISORDERS W MCC,"$26,797 "
MS812,RED BLOOD CELL DISORDERS W/O MCC,"$17,853 "
MS813,COAGULATION DISORDERS,"$24,386 "
MS821,LYMPHOMA & LEUKEMIA W MAJOR O.R. PROCEDURE W CC,"$54,561 "
MS823,LYMPHOMA & NON-ACUTE LEUKEMIA W OTHER PROC W MCC,"$71,640 "
MS824,LYMPHOMA & NON-ACUTE LEUKEMIA W OTHER PROC W CC,"$54,134 "
MS825,LYMPHOMA & NON-ACUTE LEUKEMIA W OTHER PROC W/O CC/MCC,"$32,831 "
MS827,MYELOPROLIF DISORD OR POORLY DIFF NEOPL W MAJ O.R. PROC W CC,"$65,974 "
MS840,LYMPHOMA & NON-ACUTE LEUKEMIA W MCC,"$37,595 "
MS841,LYMPHOMA & NON-ACUTE LEUKEMIA W CC,"$28,825 "
MS843,OTHER MYELOPROLIF DIS OR POORLY DIFF NEOPL DIAG W MCC,"$16,962 "
MS844,OTHER MYELOPROLIF DIS OR POORLY DIFF NEOPL DIAG W CC,"$19,112 "
MS845,OTHER MYELOPROLIF DIS OR POORLY DIFF NEOPL DIAG W/O CC/MCC,"$14,126 "
MS847,CHEMOTHERAPY W/O ACUTE LEUKEMIA AS SECONDARY DIAGNOSIS W CC,"$13,819 "
MS853,INFECTIOUS & PARASITIC DISEASES W O.R. PROCEDURE W MCC,"$90,006 "
MS854,INFECTIOUS & PARASITIC DISEASES W O.R. PROCEDURE W CC,"$63,017 "
MS856,POSTOPERATIVE OR POST-TRAUMATIC INFECTIONS W O.R. PROC W MCC,"$75,169 "
MS857,POSTOPERATIVE OR POST-TRAUMATIC INFECTIONS W O.R. PROC W CC,"$46,101 "
MS862,POSTOPERATIVE & POST-TRAUMATIC INFECTIONS W MCC,"$39,489 "
MS863,POSTOPERATIVE & POST-TRAUMATIC INFECTIONS W/O MCC,"$20,588 "
MS864,FEVER AND INFLAMMATORY CONDITIONS,"$14,484 "
MS865,VIRAL ILLNESS W MCC,"$20,290 "
MS866,VIRAL ILLNESS W/O MCC,"$13,335 "
MS867,OTHER INFECTIOUS & PARASITIC DISEASES DIAGNOSES W MCC,"$44,674 "
MS868,OTHER INFECTIOUS & PARASITIC DISEASES DIAGNOSES W CC,"$23,045 "
MS869,OTHER INFECTIOUS & PARASITIC DISEASES DIAGNOSES W/O CC/MCC,"$21,875 "
MS870,SEPTICEMIA OR SEVERE SEPSIS W MV >96 HOURS OR PERIPHERAL EXTRACORPOREAL MEMBRANE OXYGENATION (ECMO),"$115,686 "
MS871,SEPTICEMIA OR SEVERE SEPSIS W/O MV >96 HOURS W MCC,"$37,027 "
MS872,SEPTICEMIA OR SEVERE SEPSIS W/O MV >96 HOURS W/O MCC,"$22,481 "
MS876,O.R. PROCEDURE W PRINCIPAL DIAGNOSES OF MENTAL ILLNESS,"$28,174 "
MS880,ACUTE ADJUSTMENT REACTION & PSYCHOSOCIAL DYSFUNCTION,"$25,790 "
MS881,DEPRESSIVE NEUROSES,"$19,832 "
MS882,NEUROSES EXCEPT DEPRESSIVE,"$22,969 "
MS883,DISORDERS OF PERSONALITY & IMPULSE CONTROL,"$26,377 "
MS884,ORGANIC DISTURBANCES & INTELLECTUAL DISABILITY,"$34,988 "
MS885,PSYCHOSES,"$36,426 "
MS886,BEHAVIORAL & DEVELOPMENTAL DISORDERS,"$27,672 "
MS887,OTHER MENTAL DISORDER DIAGNOSES,"$23,087 "
MS894,"ALCOHOL/DRUG ABUSE OR DEPENDENCE, LEFT AMA","$14,175 "
MS896,ALCOHOL/DRUG ABUSE OR DEPENDENCE W/O REHABILITATION THERAPY W MCC,"$28,255 "
MS897,ALCOHOL/DRUG ABUSE OR DEPENDENCE W/O REHABILITATION THERAPY W/O MCC,"$19,124 "
MS902,WOUND DEBRIDEMENTS FOR INJURIES W CC,"$23,373 "
MS907,OTHER O.R. PROCEDURES FOR INJURIES W MCC,"$52,741 "
MS908,OTHER O.R. PROCEDURES FOR INJURIES W CC,"$54,837 "
MS909,OTHER O.R. PROCEDURES FOR INJURIES W/O CC/MCC,"$33,379 "
MS914,TRAUMATIC INJURY W/O MCC,"$18,353 "
MS915,ALLERGIC REACTIONS W MCC,"$25,233 "
MS916,ALLERGIC REACTIONS W/O MCC,"$14,254 "
MS917,POISONING & TOXIC EFFECTS OF DRUGS W MCC,"$27,572 "
MS918,POISONING & TOXIC EFFECTS OF DRUGS W/O MCC,"$16,314 "
MS919,COMPLICATIONS OF TREATMENT W MCC,"$25,133 "
MS920,COMPLICATIONS OF TREATMENT W CC,"$19,623 "
MS921,COMPLICATIONS OF TREATMENT W/O CC/MCC,"$15,489 "
MS922,"OTHER INJURY, POISONING & TOXIC EFFECT DIAG W MCC","$21,338 "
MS923,"OTHER INJURY, POISONING & TOXIC EFFECT DIAG W/O MCC","$18,564 "
MS939,O.R. PROC W DIAGNOSES OF OTHER CONTACT W HEALTH SERVICES W MCC,"$56,011 "
MS940,O.R. PROC W DIAGNOSES OF OTHER CONTACT W HEALTH SERVICES W CC,"$29,659 "
MS947,SIGNS & SYMPTOMS W MCC,"$18,853 "
MS948,SIGNS & SYMPTOMS W/O MCC,"$15,021 "
MS949,AFTERCARE W CC/MCC,"$26,494 "
MS950,AFTERCARE W/O CC/MCC,"$5,730 "
MS951,OTHER FACTORS INFLUENCING HEALTH STATUS,"$7,549 "
MS956,"LIMB REATTACHMENT, HIP & FEMUR PROC FOR MULTIPLE SIGNIFICANT TRAUMA","$50,374 "
MS963,OTHER MULTIPLE SIGNIFICANT TRAUMA W MCC,"$27,407 "
MS964,OTHER MULTIPLE SIGNIFICANT TRAUMA W CC,"$19,916 "
MS965,OTHER MULTIPLE SIGNIFICANT TRAUMA W/O CC/MCC,"$11,828 "
MS974,HIV W MAJOR RELATED CONDITION W MCC,"$42,069 "
MS977,HIV W OR W/O OTHER RELATED CONDITION,"$104,678 "
MS981,EXTENSIVE O.R. PROCEDURE UNRELATED TO PRINCIPAL DIAGNOSIS W MCC,"$99,753 "
MS982,EXTENSIVE O.R. PROCEDURE UNRELATED TO PRINCIPAL DIAGNOSIS W CC,"$101,490 "
MS983,EXTENSIVE O.R. PROCEDURE UNRELATED TO PRINCIPAL DIAGNOSIS W/O CC/MCC,"$46,172 "
MS987,NON-EXTENSIVE O.R. PROC UNRELATED TO PRINCIPAL DIAGNOSIS W MCC,"$46,450 "
MS988,NON-EXTENSIVE O.R. PROC UNRELATED TO PRINCIPAL DIAGNOSIS W CC,"$46,677 "
MS989,NON-EXTENSIVE O.R. PROC UNRELATED TO PRINCIPAL DIAGNOSIS W/O CC/MCC,"$34,674 "
